Name,Description,Stars,URL,Comment,Star_Category,Project_Category,Recommendation
UTF_Tests_Animation,No description,1,https://github.com/Unity-Technologies/UTF_Tests_Animation,Low popularity - General Unity package,Düşük Popülerlik,Genel Unity Paketi,Genel kullanıma uygun.
NSubstitute.Elevated,Extension to NSubstitute that provides mocking of concrete methods and statics,12,https://github.com/Unity-Technologies/NSubstitute.Elevated,Low popularity - General Unity package,Düşük Popülerlik,Genel Unity Paketi,Genel kullanıma uygun.
go-cticker,A clock based ticker library for golang,7,https://github.com/Unity-Technologies/go-cticker,Low popularity - General Unity package,Düşük Popülerlik,Genel Unity Paketi,Genel kullanıma uygun.
rat-rnn,Simulate Rat neural activity in the maze,42,https://github.com/Unity-Technologies/rat-rnn,Low popularity - General Unity package,Düşük Popülerlik,Genel Unity Paketi,Genel kullanıma uygun.
usd-unity-sdk,Integration of Pixar's Universal Scene Description into Unity. UPDATE: This package has been superseded by our new bundle of USD packages. Please see README & link below for further details.,501,https://github.com/Unity-Technologies/usd-unity-sdk,Popular - Artificial intelligence package,Popüler,Yapay Zeka Paketi,Gelişmiş oyun yapay zekası geliştirenler için önerilir.
markdig,"A fast, powerful, CommonMark compliant, extensible Markdown processor for .NET",7,https://github.com/Unity-Technologies/markdig,Low popularity - General Unity package,Düşük Popülerlik,Genel Unity Paketi,Genel kullanıma uygun.
com.unity.cinemachine,Smart camera tools for passionate creators,528,https://github.com/Unity-Technologies/com.unity.cinemachine,Popular - Vehicle package,Popüler,Araç Paketi,Genel kullanıma uygun.
msbuild,The Microsoft Build Engine (MSBuild) is the build platform for .NET and Visual Studio.,3,https://github.com/Unity-Technologies/msbuild,Low popularity - General Unity package,Düşük Popülerlik,Genel Unity Paketi,Genel kullanıma uygun.
VR-Spectator-Sample,Sample project for understanding how to VR Spectate in Unity,46,https://github.com/Unity-Technologies/VR-Spectator-Sample,Low popularity - General Unity package,Düşük Popülerlik,Genel Unity Paketi,Genel kullanıma uygun.
360-Video-Heatmaps,Heatmaps for 360 Video,53,https://github.com/Unity-Technologies/360-Video-Heatmaps,Low popularity - General Unity package,Düşük Popülerlik,Genel Unity Paketi,Genel kullanıma uygun.
tundra,Tundra is a code build system that tries to be accurate and fast for incremental builds,39,https://github.com/Unity-Technologies/tundra,Low popularity - General Unity package,Düşük Popülerlik,Genel Unity Paketi,Genel kullanıma uygun.
logzio-dotnet,"Logz.io shippers for .NET frameworks, currently including log4net and NLog.",2,https://github.com/Unity-Technologies/logzio-dotnet,Low popularity - General Unity package,Düşük Popülerlik,Genel Unity Paketi,Genel kullanıma uygun.
com.unity.netcode.gameobjects,Netcode for GameObjects is a high-level netcode SDK that provides networking capabilities to GameObject/MonoBehaviour workflows within Unity and sits on top of underlying transport layer.,2157,https://github.com/Unity-Technologies/com.unity.netcode.gameobjects,Very popular - General Unity package,Çok Popüler,Genel Unity Paketi,AAA oyunlar için önerilir.
android-libunwind,Unity specific customizations to Android's libunwind library,15,https://github.com/Unity-Technologies/android-libunwind,Low popularity - General Unity package,Düşük Popülerlik,Genel Unity Paketi,Genel kullanıma uygun.
ConditionalCompilationUtility,Automatically add defines upon the detection of predicate classes,124,https://github.com/Unity-Technologies/ConditionalCompilationUtility,Mid-level popularity - General Unity package,Orta Popüler,Genel Unity Paketi,Genel kullanıma uygun.
AutoLOD,Automatic LOD generation + scene optimization,1868,https://github.com/Unity-Technologies/AutoLOD,Very popular - General Unity package,Çok Popüler,Genel Unity Paketi,AAA oyunlar için önerilir.
ftpserver,golang ftp server library with a sample implementation,1,https://github.com/Unity-Technologies/ftpserver,Low popularity - General Unity package,Düşük Popülerlik,Genel Unity Paketi,Genel kullanıma uygun.
UnityMeshSimplifier,Mesh simplification for Unity.,364,https://github.com/Unity-Technologies/UnityMeshSimplifier,Mid-level popularity - General Unity package,Orta Popüler,Genel Unity Paketi,Genel kullanıma uygun.
symbolstrip,A tool to remove symbols from .NET Assemblies,6,https://github.com/Unity-Technologies/symbolstrip,Low popularity - General Unity package,Düşük Popülerlik,Genel Unity Paketi,Genel kullanıma uygun.
ToolsCollection,A collection of all the small tools we,181,https://github.com/Unity-Technologies/ToolsCollection,Mid-level popularity - Vehicle package,Orta Popüler,Araç Paketi,Yeni başlayanlar için önerilir.
BoatAttack,Demo Project using the Universal RP from Unity3D,2569,https://github.com/Unity-Technologies/BoatAttack,Very popular - General Unity package,Çok Popüler,Genel Unity Paketi,AAA oyunlar için önerilir.
homebrew-dotnet-updatepkg,Utility script that can consolidate and update nuget packages across projects,2,https://github.com/Unity-Technologies/homebrew-dotnet-updatepkg,Low popularity - General Unity package,Düşük Popülerlik,Genel Unity Paketi,Genel kullanıma uygun.
progroups,Organize your scene with groups and visibility toggles.,33,https://github.com/Unity-Technologies/progroups,Low popularity - General Unity package,Düşük Popülerlik,Genel Unity Paketi,Genel kullanıma uygun.
ScriptableRenderPipelineData,Data for Scriptable Render Pipeline,96,https://github.com/Unity-Technologies/ScriptableRenderPipelineData,Low popularity - Render or graphics package,Düşük Popülerlik,Render/Grafik Paketi,Genel kullanıma uygun.
ProBuilder-API-Examples,"This code has moved into the ProBuilder repository under ""Samples~""",113,https://github.com/Unity-Technologies/ProBuilder-API-Examples,Mid-level popularity - General Unity package,Orta Popüler,Genel Unity Paketi,Genel kullanıma uygun.
Animation-Instancing,This technique is designed to instance Characters(SkinnedMeshRender). ,1678,https://github.com/Unity-Technologies/Animation-Instancing,Very popular - Render or graphics package,Çok Popüler,Render/Grafik Paketi,AAA oyunlar için önerilir.
2d-animation-samples,Samples for 2D Animation features.,199,https://github.com/Unity-Technologies/2d-animation-samples,Mid-level popularity - General Unity package,Orta Popüler,Genel Unity Paketi,Genel kullanıma uygun.
2d-spriteshape-samples,Samples for the 2D SpriteShape feature.,210,https://github.com/Unity-Technologies/2d-spriteshape-samples,Mid-level popularity - General Unity package,Orta Popüler,Genel Unity Paketi,Genel kullanıma uygun.
exampleunity,An example Unity project.,3,https://github.com/Unity-Technologies/exampleunity,Low popularity - General Unity package,Düşük Popülerlik,Genel Unity Paketi,Genel kullanıma uygun.
EntityComponentSystemSamples,No description,7269,https://github.com/Unity-Technologies/EntityComponentSystemSamples,Very popular - General Unity package,Çok Popüler,Genel Unity Paketi,AAA oyunlar için önerilir.
UniteAustinTechnicalPresentation,No description,763,https://github.com/Unity-Technologies/UniteAustinTechnicalPresentation,Popular - General Unity package,Popüler,Genel Unity Paketi,Genel kullanıma uygun.
UnityCsReference,Unity C# reference source code.,11939,https://github.com/Unity-Technologies/UnityCsReference,Very popular - General Unity package,Çok Popüler,Genel Unity Paketi,AAA oyunlar için önerilir.
SuperScience,Gems of Unity Labs for our user-base.,719,https://github.com/Unity-Technologies/SuperScience,Popular - General Unity package,Popüler,Genel Unity Paketi,Genel kullanıma uygun.
redsync,Distributed mutual exclusion lock using Redis for Go,1,https://github.com/Unity-Technologies/redsync,Low popularity - General Unity package,Düşük Popülerlik,Genel Unity Paketi,Genel kullanıma uygun.
Standard-Assets-Characters,Unity Standard Asset Controllers,607,https://github.com/Unity-Technologies/Standard-Assets-Characters,Popular - General Unity package,Popüler,Genel Unity Paketi,Genel kullanıma uygun.
vector-graphics-samples,SVG and Vector Graphics Sample Project,193,https://github.com/Unity-Technologies/vector-graphics-samples,Mid-level popularity - Render or graphics package,Orta Popüler,Render/Grafik Paketi,Genel kullanıma uygun.
guid-based-reference,A component for giving Game Objects a GUID and a class to create references to objects in any Scene by GUID,630,https://github.com/Unity-Technologies/guid-based-reference,Popular - General Unity package,Popüler,Genel Unity Paketi,Genel kullanıma uygun.
gitlab_ci_test,No description,1,https://github.com/Unity-Technologies/gitlab_ci_test,Low popularity - General Unity package,Düşük Popülerlik,Genel Unity Paketi,Genel kullanıma uygun.
2d-pixel-perfect,Pixel Perfect Camera,243,https://github.com/Unity-Technologies/2d-pixel-perfect,Mid-level popularity - General Unity package,Orta Popüler,Genel Unity Paketi,Genel kullanıma uygun.
ShaderForge,No description,28,https://github.com/Unity-Technologies/ShaderForge,Low popularity - General Unity package,Düşük Popülerlik,Genel Unity Paketi,Genel kullanıma uygun.
MissilesPerfectMaster,A compute shader demo for Unite 2018 Tokyo.,178,https://github.com/Unity-Technologies/MissilesPerfectMaster,Mid-level popularity - General Unity package,Orta Popüler,Genel Unity Paketi,Genel kullanıma uygun.
Gamekit3D,No description,196,https://github.com/Unity-Technologies/Gamekit3D,Mid-level popularity - General Unity package,Orta Popüler,Genel Unity Paketi,Genel kullanıma uygun.
EndlessRunnerSampleGame,Repository for the Endless Runner Game Sample (Trash Dash),393,https://github.com/Unity-Technologies/EndlessRunnerSampleGame,Mid-level popularity - General Unity package,Orta Popüler,Genel Unity Paketi,Genel kullanıma uygun.
hot-fuzz,HotFuzz is a fuzz testing utility that generates random data and sends it to a service's endpoint over HTTP or HTTPS based on a given fuzzing model written in JSON.,18,https://github.com/Unity-Technologies/hot-fuzz,Low popularity - General Unity package,Düşük Popülerlik,Genel Unity Paketi,Genel kullanıma uygun.
mono-unity,Unity extensions for Mono,11,https://github.com/Unity-Technologies/mono-unity,Low popularity - General Unity package,Düşük Popülerlik,Genel Unity Paketi,Genel kullanıma uygun.
SharedSpheres,An example project to demonstrate an AR shared multiplayer experience using Unity ARKit Plugin for ARKit 2 and UNet,82,https://github.com/Unity-Technologies/SharedSpheres,Low popularity - General Unity package,Düşük Popülerlik,Genel Unity Paketi,Genel kullanıma uygun.
protopolis,Unity environment with assets and packages to build a city.,9,https://github.com/Unity-Technologies/protopolis,Low popularity - General Unity package,Düşük Popülerlik,Genel Unity Paketi,Genel kullanıma uygun.
animation-jobs-samples,Code samples using the animation C# jobs feature.,505,https://github.com/Unity-Technologies/animation-jobs-samples,Popular - General Unity package,Popüler,Genel Unity Paketi,Genel kullanıma uygun.
arfoundation-samples,Example content for Unity projects based on AR Foundation,3095,https://github.com/Unity-Technologies/arfoundation-samples,Very popular - General Unity package,Çok Popüler,Genel Unity Paketi,AAA oyunlar için önerilir.
vast,Golang VAST 3.0 library,1,https://github.com/Unity-Technologies/vast,Low popularity - General Unity package,Düşük Popülerlik,Genel Unity Paketi,Genel kullanıma uygun.
procore-legacy-docs,No description,1,https://github.com/Unity-Technologies/procore-legacy-docs,Low popularity - General Unity package,Düşük Popülerlik,Genel Unity Paketi,Genel kullanıma uygun.
facial-ar-remote,**This project is discontinued** Facial AR Remote is a tool that allows you to capture blendshape animations directly from your iPhone X into Unity 3d by use of an app on your phone.,490,https://github.com/Unity-Technologies/facial-ar-remote,Mid-level popularity - General Unity package,Orta Popüler,Genel Unity Paketi,Genel kullanıma uygun.
hw18-adventuregame,No description,16,https://github.com/Unity-Technologies/hw18-adventuregame,Low popularity - General Unity package,Düşük Popülerlik,Genel Unity Paketi,Genel kullanıma uygun.
influxdata-docker,Official docker images for the influxdata stack,0,https://github.com/Unity-Technologies/influxdata-docker,Low popularity - General Unity package,Düşük Popülerlik,Genel Unity Paketi,Genel kullanıma uygun.
openrtb,No description,5,https://github.com/Unity-Technologies/openrtb,Low popularity - General Unity package,Düşük Popülerlik,Genel Unity Paketi,Genel kullanıma uygun.
pythonnet,Python for .NET is a package that gives Python programmers nearly seamless integration with the .NET Common Language Runtime (CLR) and provides a powerful application scripting tool for .NET developers.,91,https://github.com/Unity-Technologies/pythonnet,Low popularity - General Unity package,Düşük Popülerlik,Genel Unity Paketi,Genel kullanıma uygun.
resonance-audio,Resonance Audio Source Code,4,https://github.com/Unity-Technologies/resonance-audio,Low popularity - General Unity package,Düşük Popülerlik,Genel Unity Paketi,Genel kullanıma uygun.
proxysql,Multiplay-enhanced ProxySQL (ONLY FOR 1.4.9 BRANCH)! See upstream for more helpful description.,0,https://github.com/Unity-Technologies/proxysql,Low popularity - General Unity package,Düşük Popülerlik,Genel Unity Paketi,Genel kullanıma uygun.
ReproProjectWizard,Quickly create a new project that contains a small subset of the assets in your full project.,45,https://github.com/Unity-Technologies/ReproProjectWizard,Low popularity - Artificial intelligence package,Düşük Popülerlik,Yapay Zeka Paketi,Gelişmiş oyun yapay zekası geliştirenler için önerilir.
XRAcceptanceTests,"This project is used to verify behavior of Unity configurations, compare features between Unity releases, and test for changes in performance.",35,https://github.com/Unity-Technologies/XRAcceptanceTests,Low popularity - General Unity package,Düşük Popülerlik,Genel Unity Paketi,Genel kullanıma uygun.
XRAutomatedTests,"XRAutomatedTests is where you can find functional, graphics, performance, and other types of automated tests for your XR Unity development. ",103,https://github.com/Unity-Technologies/XRAutomatedTests,Mid-level popularity - Render or graphics package,Orta Popüler,Render/Grafik Paketi,Genel kullanıma uygun.
PerformanceBenchmarkReporter,"The Unity Performance Benchmark tool enables partners and developers to establish benchmark samples and measurements using the Performance Testing package, then use these benchmark values to compare subsequent performance test results in an html output utilizing graphical visualizations.",121,https://github.com/Unity-Technologies/PerformanceBenchmarkReporter,Mid-level popularity - General Unity package,Orta Popüler,Genel Unity Paketi,Genel kullanıma uygun.
go-xgboost,XGBoost bindings for golang,76,https://github.com/Unity-Technologies/go-xgboost,Low popularity - General Unity package,Düşük Popülerlik,Genel Unity Paketi,Genel kullanıma uygun.
AnotherThreadECS,A demo made with ECS,113,https://github.com/Unity-Technologies/AnotherThreadECS,Mid-level popularity - General Unity package,Orta Popüler,Genel Unity Paketi,Genel kullanıma uygun.
storage-transfer-sync,No description,3,https://github.com/Unity-Technologies/storage-transfer-sync,Low popularity - General Unity package,Düşük Popülerlik,Genel Unity Paketi,Genel kullanıma uygun.
marathon-envs,A set of high-dimensional continuous control environments for use with Unity ML-Agents Toolkit.,299,https://github.com/Unity-Technologies/marathon-envs,Mid-level popularity - General Unity package,Orta Popüler,Genel Unity Paketi,Genel kullanıma uygun.
VFXToolbox,Additional tools for Visual Effect Artists,1149,https://github.com/Unity-Technologies/VFXToolbox,Very popular - Vehicle package,Çok Popüler,Araç Paketi,AAA oyunlar için önerilir.
RadeonRays_SDK,Radeon Rays is ray intersection acceleration library for hardware and software multiplatforms using CPU and GPU,7,https://github.com/Unity-Technologies/RadeonRays_SDK,Low popularity - General Unity package,Düşük Popülerlik,Genel Unity Paketi,Genel kullanıma uygun.
kubernetes-ci-cd,https://www.linux.com/blog/learn/chapter/Intro-to-Kubernetes/2017/5/set-cicd-pipeline-kubernetes-part-1-overview,1,https://github.com/Unity-Technologies/kubernetes-ci-cd,Low popularity - General Unity package,Düşük Popülerlik,Genel Unity Paketi,Genel kullanıma uygun.
corefx,This repository contains the foundational libraries that make up the .NET Core development stack.,3,https://github.com/Unity-Technologies/corefx,Low popularity - Artificial intelligence package,Düşük Popülerlik,Yapay Zeka Paketi,Gelişmiş oyun yapay zekası geliştirenler için önerilir.
tk-config-unity,No description,7,https://github.com/Unity-Technologies/tk-config-unity,Low popularity - General Unity package,Düşük Popülerlik,Genel Unity Paketi,Genel kullanıma uygun.
tk-unity,No description,9,https://github.com/Unity-Technologies/tk-unity,Low popularity - General Unity package,Düşük Popülerlik,Genel Unity Paketi,Genel kullanıma uygun.
Onslaught,A multiplatform XR sample game with no third-party packages.,112,https://github.com/Unity-Technologies/Onslaught,Mid-level popularity - General Unity package,Orta Popüler,Genel Unity Paketi,Genel kullanıma uygun.
XRInputTests,Manual Input tests that are used by the Unity X-Reality Quality Assurance team to understand status across virtual reality and augmented reality platforms.,44,https://github.com/Unity-Technologies/XRInputTests,Low popularity - General Unity package,Düşük Popülerlik,Genel Unity Paketi,Genel kullanıma uygun.
UnetEncryptionExample,"Contains a reference implementation of a native Unet encryption plugin, as well as a very small example Unity project that uses the plugin.",23,https://github.com/Unity-Technologies/UnetEncryptionExample,Low popularity - Artificial intelligence package,Düşük Popülerlik,Yapay Zeka Paketi,Gelişmiş oyun yapay zekası geliştirenler için önerilir.
kubernetes-deploy,A Go module for deploying to Kubernetes and retrieving status of that deploy. Useful for deploy bots.,9,https://github.com/Unity-Technologies/kubernetes-deploy,Low popularity - General Unity package,Düşük Popülerlik,Genel Unity Paketi,Genel kullanıma uygun.
TerrainToolSamples,"Unity has archived the TerrainToolSamples repository. For future development, please use the Terrain Tools package.",218,https://github.com/Unity-Technologies/TerrainToolSamples,Mid-level popularity - Vehicle package,Orta Popüler,Araç Paketi,Yeni başlayanlar için önerilir.
Graphics-Test-Framework-Examples,Example project for https://github.com/Unity-Technologies/Graphics-Test-Framework,7,https://github.com/Unity-Technologies/Graphics-Test-Framework-Examples,Low popularity - Render or graphics package,Düşük Popülerlik,Render/Grafik Paketi,Genel kullanıma uygun.
sqlx,general purpose extensions to golang's database/sql,0,https://github.com/Unity-Technologies/sqlx,Low popularity - General Unity package,Düşük Popülerlik,Genel Unity Paketi,Genel kullanıma uygun.
FPSSample,A first person multiplayer shooter example project in Unity,4906,https://github.com/Unity-Technologies/FPSSample,Very popular - General Unity package,Çok Popüler,Genel Unity Paketi,AAA oyunlar için önerilir.
BackgroundDownload,Plugins for mobile platforms to enable file downloads in background,725,https://github.com/Unity-Technologies/BackgroundDownload,Popular - General Unity package,Popüler,Genel Unity Paketi,Genel kullanıma uygun.
profiler-snapshot-tool,Tool to make it easier to profile the editor without having the profiler window open. To use it: Tests/Profiler/Toggle Snapshot.,22,https://github.com/Unity-Technologies/profiler-snapshot-tool,Low popularity - General Unity package,Düşük Popülerlik,Genel Unity Paketi,Genel kullanıma uygun.
multiplayer,Unity multiplayer packages and samples,1313,https://github.com/Unity-Technologies/multiplayer,Very popular - General Unity package,Çok Popüler,Genel Unity Paketi,AAA oyunlar için önerilir.
PrefabAPIExamples,Example code using the Prefab API,99,https://github.com/Unity-Technologies/PrefabAPIExamples,Low popularity - General Unity package,Düşük Popülerlik,Genel Unity Paketi,Genel kullanıma uygun.
com.unity.probuilder,No description,356,https://github.com/Unity-Technologies/com.unity.probuilder,Mid-level popularity - General Unity package,Orta Popüler,Genel Unity Paketi,Genel kullanıma uygun.
asset-auditing-tools,A set of Editor tools to audit project assets and correct errors,76,https://github.com/Unity-Technologies/asset-auditing-tools,Low popularity - Vehicle package,Düşük Popülerlik,Araç Paketi,Yeni başlayanlar için önerilir.
TraceEventProfiler,Capture Unity profile data to the Trace Event Format using the Unity Profiler Plugin API,22,https://github.com/Unity-Technologies/TraceEventProfiler,Low popularity - General Unity package,Düşük Popülerlik,Genel Unity Paketi,Genel kullanıma uygun.
SRPBatcherBenchmark,various benchmark scenes for SRP batcher ( both LWRP & HDRP ),212,https://github.com/Unity-Technologies/SRPBatcherBenchmark,Mid-level popularity - General Unity package,Orta Popüler,Genel Unity Paketi,Genel kullanıma uygun.
go-openrtb,OpenRTB v2.5 / Native v1.2 types for Go programming language (Golang),2,https://github.com/Unity-Technologies/go-openrtb,Low popularity - General Unity package,Düşük Popülerlik,Genel Unity Paketi,Genel kullanıma uygun.
obstacle-tower-challenge,Starter Kit for the Unity Obstacle Tower challenge,119,https://github.com/Unity-Technologies/obstacle-tower-challenge,Mid-level popularity - General Unity package,Orta Popüler,Genel Unity Paketi,Genel kullanıma uygun.
VisualEffectGraph-Samples,Visual Effect Graph - Samples Project,1902,https://github.com/Unity-Technologies/VisualEffectGraph-Samples,Very popular - General Unity package,Çok Popüler,Genel Unity Paketi,AAA oyunlar için önerilir.
obstacle-tower-env,Obstacle Tower Environment,543,https://github.com/Unity-Technologies/obstacle-tower-env,Popular - General Unity package,Popüler,Genel Unity Paketi,Genel kullanıma uygun.
NotificationsSamples,Sample project for Unity Notifications,285,https://github.com/Unity-Technologies/NotificationsSamples,Mid-level popularity - General Unity package,Orta Popüler,Genel Unity Paketi,Genel kullanıma uygun.
VehicleTools,This sample project provides a series of tools to rig wheeled vehicles,139,https://github.com/Unity-Technologies/VehicleTools,Mid-level popularity - Vehicle package,Orta Popüler,Araç Paketi,Yeni başlayanlar için önerilir.
SimpleIKSolver,No description,53,https://github.com/Unity-Technologies/SimpleIKSolver,Low popularity - General Unity package,Düşük Popülerlik,Genel Unity Paketi,Genel kullanıma uygun.
ZombieObjectDetector,"Tool for detecting ""Fake Null"" C# instances.",154,https://github.com/Unity-Technologies/ZombieObjectDetector,Mid-level popularity - General Unity package,Orta Popüler,Genel Unity Paketi,Genel kullanıma uygun.
SplineToolTutorial,No description,63,https://github.com/Unity-Technologies/SplineToolTutorial,Low popularity - General Unity package,Düşük Popülerlik,Genel Unity Paketi,Genel kullanıma uygun.
UIElementsUniteLATurretDemo,Demo Used in Unite LA 2018 UIElements talk.,75,https://github.com/Unity-Technologies/UIElementsUniteLATurretDemo,Low popularity - General Unity package,Düşük Popülerlik,Genel Unity Paketi,Genel kullanıma uygun.
zlib,A massively spiffy yet delicately unobtrusive compression library.,7,https://github.com/Unity-Technologies/zlib,Low popularity - General Unity package,Düşük Popülerlik,Genel Unity Paketi,Genel kullanıma uygun.
Addressables-Sample,Demo project using Addressables package,1320,https://github.com/Unity-Technologies/Addressables-Sample,Very popular - General Unity package,Çok Popüler,Genel Unity Paketi,AAA oyunlar için önerilir.
Timeline-MessageMarker,Timeline Message markers,60,https://github.com/Unity-Technologies/Timeline-MessageMarker,Low popularity - General Unity package,Düşük Popülerlik,Genel Unity Paketi,Genel kullanıma uygun.
2d-animation-v2-samples,Samples for 2D Animation v2.,54,https://github.com/Unity-Technologies/2d-animation-v2-samples,Low popularity - General Unity package,Düşük Popülerlik,Genel Unity Paketi,Genel kullanıma uygun.
com.unity.integrations.shotgrid,No description,11,https://github.com/Unity-Technologies/com.unity.integrations.shotgrid,Low popularity - General Unity package,Düşük Popülerlik,Genel Unity Paketi,Genel kullanıma uygun.
ShaderGraphFeatureDemo_LitMasterNode,Simple HD RP project to showcase new Lit master node.,71,https://github.com/Unity-Technologies/ShaderGraphFeatureDemo_LitMasterNode,Low popularity - General Unity package,Düşük Popülerlik,Genel Unity Paketi,Genel kullanıma uygun.
film-tv-toolbox,"Collection of experimental, proof of concept or helper tools for Film / TV productions.",103,https://github.com/Unity-Technologies/film-tv-toolbox,Mid-level popularity - Vehicle package,Orta Popüler,Araç Paketi,Yeni başlayanlar için önerilir.
FontainebleauDemo,Fontainebleau demo,1120,https://github.com/Unity-Technologies/FontainebleauDemo,Very popular - Artificial intelligence package,Çok Popüler,Yapay Zeka Paketi,AAA oyunlar için önerilir.
HLODSystem,No description,892,https://github.com/Unity-Technologies/HLODSystem,Popular - General Unity package,Popüler,Genel Unity Paketi,Genel kullanıma uygun.
