Name,Description,Stars,URL,Comment,Star_Category,Project_Category,Recommendation
com.unity.multiplayer.docs,"Open Source documentation for Unity Multiplayer, which includes Netcode for GameObjects, the Unity Transport Package, Multiplayer Tools and Educational references and Sample Games such as Boss Room.",672,https://github.com/Unity-Technologies/com.unity.multiplayer.docs,Popular - Vehicle package,Popüler,Araç Paketi,Genel kullanıma uygun.
RadeonImageFilter,No description,2,https://github.com/Unity-Technologies/RadeonImageFilter,Low popularity - General Unity package,Düşük Popülerlik,Genel Unity Paketi,Genel kullanıma uygun.
com.unity.simviz,"SimViz contains tools and resources for authoring and executing autonomous vehicle simulations on roadways and city scapes by using map import, scene creation, formatting of ground truth data, and creating spline based roads.",60,https://github.com/Unity-Technologies/com.unity.simviz,Low popularity - Vehicle package,Düşük Popülerlik,Araç Paketi,Yeni başlayanlar için önerilir.
com.unity.multiplayer.samples.coop,"A small-scale cooperative game sample built on the new, Unity networking framework to teach developers about creating a similar multiplayer game.",1632,https://github.com/Unity-Technologies/com.unity.multiplayer.samples.coop,Very popular - General Unity package,Çok Popüler,Genel Unity Paketi,AAA oyunlar için önerilir.
URDF-Importer,URDF importer,233,https://github.com/Unity-Technologies/URDF-Importer,Mid-level popularity - General Unity package,Orta Popüler,Genel Unity Paketi,Genel kullanıma uygun.
URPCloudRenderingTestProject,No description,7,https://github.com/Unity-Technologies/URPCloudRenderingTestProject,Low popularity - General Unity package,Düşük Popülerlik,Genel Unity Paketi,Genel kullanıma uygun.
VHACD-deprecated,This repository has migrated to Unity-Technologies/VHACD,70,https://github.com/Unity-Technologies/VHACD-deprecated,Low popularity - General Unity package,Düşük Popülerlik,Genel Unity Paketi,Genel kullanıma uygun.
action-slack,Provides the function of slack notification to GitHub Actions.,2,https://github.com/Unity-Technologies/action-slack,Low popularity - General Unity package,Düşük Popülerlik,Genel Unity Paketi,Genel kullanıma uygun.
com.unity.ide.vscode,Code editor integration for VSCode.,30,https://github.com/Unity-Technologies/com.unity.ide.vscode,Low popularity - General Unity package,Düşük Popülerlik,Genel Unity Paketi,Genel kullanıma uygun.
renovate,Universal dependency update tool that fits into your workflows.,3,https://github.com/Unity-Technologies/renovate,Low popularity - General Unity package,Düşük Popülerlik,Genel Unity Paketi,Genel kullanıma uygun.
ProjectAuditor,Project Auditor is an experimental static analysis tool for Unity Projects.,838,https://github.com/Unity-Technologies/ProjectAuditor,Popular - General Unity package,Popüler,Genel Unity Paketi,Genel kullanıma uygun.
PS-DOTSStructuralChangeTests,Tests for structural change performance in DOTS,6,https://github.com/Unity-Technologies/PS-DOTSStructuralChangeTests,Low popularity - General Unity package,Düşük Popülerlik,Genel Unity Paketi,Genel kullanıma uygun.
PS-DOTSChunkDefragmentationSample,No description,7,https://github.com/Unity-Technologies/PS-DOTSChunkDefragmentationSample,Low popularity - General Unity package,Düşük Popülerlik,Genel Unity Paketi,Genel kullanıma uygun.
Game-Simulation-Match-3-Sample,Game Simulation Match 3 Sample,39,https://github.com/Unity-Technologies/Game-Simulation-Match-3-Sample,Low popularity - General Unity package,Düşük Popülerlik,Genel Unity Paketi,Genel kullanıma uygun.
idb,idb is a flexible command line interface for automating iOS simulators and devices,6,https://github.com/Unity-Technologies/idb,Low popularity - General Unity package,Düşük Popülerlik,Genel Unity Paketi,Genel kullanıma uygun.
reflect.publisher.csharp,Use the Unity Reflect Publisher API to build C# applications or plugins that publish 3D models to Unity Reflect.,9,https://github.com/Unity-Technologies/reflect.publisher.csharp,Low popularity - General Unity package,Düşük Popülerlik,Genel Unity Paketi,Genel kullanıma uygun.
com.unity.ads.ios-support,Provides support for App Tracking Transparency and SkAdNetwork API newly introduced in Apple iOS 14.,81,https://github.com/Unity-Technologies/com.unity.ads.ios-support,Low popularity - General Unity package,Düşük Popülerlik,Genel Unity Paketi,Genel kullanıma uygun.
jsonnet-libs,Unity Jsonnet libs,7,https://github.com/Unity-Technologies/jsonnet-libs,Low popularity - General Unity package,Düşük Popülerlik,Genel Unity Paketi,Genel kullanıma uygun.
ios-sdk,The deltaDNA analytics iOS SDK.,1,https://github.com/Unity-Technologies/ios-sdk,Low popularity - General Unity package,Düşük Popülerlik,Genel Unity Paketi,Genel kullanıma uygun.
CocoaPods,deltaDNA's CocoaPods Specs repository,1,https://github.com/Unity-Technologies/CocoaPods,Low popularity - General Unity package,Düşük Popülerlik,Genel Unity Paketi,Genel kullanıma uygun.
ShaderGraph-MasterStack-Samples,A sample project using the Universal Render Pipeline that includes examples to demo latest ShaderGraph feature - MasterStack,155,https://github.com/Unity-Technologies/ShaderGraph-MasterStack-Samples,Mid-level popularity - Render or graphics package,Orta Popüler,Render/Grafik Paketi,Genel kullanıma uygun.
UnityTextureAccessApiExamples,Example project for Unity 2020.1+ texture data access APIs,143,https://github.com/Unity-Technologies/UnityTextureAccessApiExamples,Mid-level popularity - General Unity package,Orta Popüler,Genel Unity Paketi,Genel kullanıma uygun.
ucb-android-sdks-testing,🤖Android SDK and NDK Testing for UCB,3,https://github.com/Unity-Technologies/ucb-android-sdks-testing,Low popularity - General Unity package,Düşük Popülerlik,Genel Unity Paketi,Genel kullanıma uygun.
ucb-tests-ghostly-toast-github,Testing project for UCB. Built in 2017.4.30f1.,1,https://github.com/Unity-Technologies/ucb-tests-ghostly-toast-github,Low popularity - General Unity package,Düşük Popülerlik,Genel Unity Paketi,Genel kullanıma uygun.
Robotics-Object-Pose-Estimation,A complete end-to-end demonstration in which we collect training data in Unity and use that data to train a deep neural network to predict the pose of a cube. This model is then deployed in a simulated robotic pick-and-place task.,300,https://github.com/Unity-Technologies/Robotics-Object-Pose-Estimation,Mid-level popularity - Artificial intelligence package,Orta Popüler,Yapay Zeka Paketi,Gelişmiş oyun yapay zekası geliştirenler için önerilir.
com.unity.toonshader,Unity Toon Shader ( an experimental package ),1100,https://github.com/Unity-Technologies/com.unity.toonshader,Very popular - General Unity package,Çok Popüler,Genel Unity Paketi,AAA oyunlar için önerilir.
S22.Xmpp,S22.Xmpp is an easy-to-use and well-documented .NET assembly for communicating with an XMPP server. It supports basic Instant Messaging and Presence funtionality as well as a variety of XMPP extensions.,1,https://github.com/Unity-Technologies/S22.Xmpp,Low popularity - General Unity package,Düşük Popülerlik,Genel Unity Paketi,Genel kullanıma uygun.
simple-exec,🏃 A .NET library that runs external commands.,7,https://github.com/Unity-Technologies/simple-exec,Low popularity - General Unity package,Düşük Popülerlik,Genel Unity Paketi,Genel kullanıma uygun.
com.unity.search.extensions,"This package contains a bunch of examples, samples and queries to be used with Unity Search.",192,https://github.com/Unity-Technologies/com.unity.search.extensions,Mid-level popularity - Artificial intelligence package,Orta Popüler,Yapay Zeka Paketi,Gelişmiş oyun yapay zekası geliştirenler için önerilir.
tensorflow,An Open Source Machine Learning Framework for Everyone,6,https://github.com/Unity-Technologies/tensorflow,Low popularity - General Unity package,Düşük Popülerlik,Genel Unity Paketi,Genel kullanıma uygun.
sol-games-unity-samples,Unity code samples from the Accelerate Solutions Games team,46,https://github.com/Unity-Technologies/sol-games-unity-samples,Low popularity - General Unity package,Düşük Popülerlik,Genel Unity Paketi,Genel kullanıma uygun.
drone-pose-estimation-navigation,Pose Estimation for drones ,17,https://github.com/Unity-Technologies/drone-pose-estimation-navigation,Low popularity - General Unity package,Düşük Popülerlik,Genel Unity Paketi,Genel kullanıma uygun.
deploy-sourcegraph,Deploy Sourcegraph to a Kubernetes cluster for large-scale code search and intelligence,1,https://github.com/Unity-Technologies/deploy-sourcegraph,Low popularity - General Unity package,Düşük Popülerlik,Genel Unity Paketi,Genel kullanıma uygun.
com.unity.xr-content.mars-sim-environments,The MARS Simulation environment assets (3d models + prefabs).  The raw assets are provided as a reference + building block for users but the MARS integration requires Unity MARS.,3,https://github.com/Unity-Technologies/com.unity.xr-content.mars-sim-environments,Low popularity - General Unity package,Düşük Popülerlik,Genel Unity Paketi,Genel kullanıma uygun.
com.unity.xr-content.template-mars-basic,"The basic MARS use-case templates. Single feature setups, like single plane, tabletop, face, etc.",2,https://github.com/Unity-Technologies/com.unity.xr-content.template-mars-basic,Low popularity - General Unity package,Düşük Popülerlik,Genel Unity Paketi,Genel kullanıma uygun.
com.unity.xr-content.template-mars-platformer,"The MARS platforming game template. This is the robot demo we've typically showed off when explaining the MARS workflow and features.  It is a dynamic, world-aware AR platformer game that will extend for as far as one can scan.",11,https://github.com/Unity-Technologies/com.unity.xr-content.template-mars-platformer,Low popularity - Artificial intelligence package,Düşük Popülerlik,Yapay Zeka Paketi,Gelişmiş oyun yapay zekası geliştirenler için önerilir.
com.unity.xr-content.template-training,A factory training template. Contains an extensible walkthrough system of conditions and triggers so that users can make their own guided experiences. The demo scene is set up to work with the MARS factory environment.,10,https://github.com/Unity-Technologies/com.unity.xr-content.template-training,Low popularity - Artificial intelligence package,Düşük Popülerlik,Yapay Zeka Paketi,Gelişmiş oyun yapay zekası geliştirenler için önerilir.
com.unity.multiplayer.samples.bitesize,A collection of smaller Bitesize samples to educate in isolation features of Netcode for GameObjects and related technologies.,371,https://github.com/Unity-Technologies/com.unity.multiplayer.samples.bitesize,Mid-level popularity - General Unity package,Orta Popüler,Genel Unity Paketi,Genel kullanıma uygun.
helm-unittest,BDD styled unit test framework for Kubernetes Helm charts as a Helm plugin.,1,https://github.com/Unity-Technologies/helm-unittest,Low popularity - General Unity package,Düşük Popülerlik,Genel Unity Paketi,Genel kullanıma uygun.
unity-mediation-cocoapods-prod,A publicly hosted Cocoapods repo for mediation SDKs,8,https://github.com/Unity-Technologies/unity-mediation-cocoapods-prod,Low popularity - General Unity package,Düşük Popülerlik,Genel Unity Paketi,Genel kullanıma uygun.
Robotics-Warehouse,A warehouse environment for robotics simulation in Unity.,71,https://github.com/Unity-Technologies/Robotics-Warehouse,Low popularity - General Unity package,Düşük Popülerlik,Genel Unity Paketi,Genel kullanıma uygun.
DataflowTemplates,Google-provided Cloud Dataflow template pipelines for solving simple in-Cloud data tasks,1,https://github.com/Unity-Technologies/DataflowTemplates,Low popularity - General Unity package,Düşük Popülerlik,Genel Unity Paketi,Genel kullanıma uygun.
com.unity.services.samples.game-lobby,A sample showcasing a minimal implementation of a lobby experience using the Lobby and Relay packages.,218,https://github.com/Unity-Technologies/com.unity.services.samples.game-lobby,Mid-level popularity - General Unity package,Orta Popüler,Genel Unity Paketi,Genel kullanıma uygun.
emsdk,Emscripten SDK,1,https://github.com/Unity-Technologies/emsdk,Low popularity - General Unity package,Düşük Popülerlik,Genel Unity Paketi,Genel kullanıma uygun.
lightning-hydra-template,"PyTorch Lightning + Hydra. A very general, feature-rich template for rapid and scalable ML experimentation with best practices. ⚡🔥⚡",3,https://github.com/Unity-Technologies/lightning-hydra-template,Low popularity - General Unity package,Düşük Popülerlik,Genel Unity Paketi,Genel kullanıma uygun.
scrcpy,Display and control your Android device,4,https://github.com/Unity-Technologies/scrcpy,Low popularity - General Unity package,Düşük Popülerlik,Genel Unity Paketi,Genel kullanıma uygun.
godruid,An open source Golang client for Druid,1,https://github.com/Unity-Technologies/godruid,Low popularity - General Unity package,Düşük Popülerlik,Genel Unity Paketi,Genel kullanıma uygun.
DracoUnity,Draco 3D Data Compression Unity Package,12,https://github.com/Unity-Technologies/DracoUnity,Low popularity - General Unity package,Düşük Popülerlik,Genel Unity Paketi,Genel kullanıma uygun.
Robotics-Nav2-SLAM-Example,"An example project which contains the Unity components necessary to complete Navigation2's SLAM tutorial with a Turtlebot3, using a custom Unity environment in place of Gazebo.",340,https://github.com/Unity-Technologies/Robotics-Nav2-SLAM-Example,Mid-level popularity - Artificial intelligence package,Orta Popüler,Yapay Zeka Paketi,Gelişmiş oyun yapay zekası geliştirenler için önerilir.
gremlin-helm,Helm chart for deploy Gremlin client,1,https://github.com/Unity-Technologies/gremlin-helm,Low popularity - General Unity package,Düşük Popülerlik,Genel Unity Paketi,Genel kullanıma uygun.
SZZUnleashed,"An implementation of the SZZ algorithm, i.e., an approach to identify bug-introducing commits.",2,https://github.com/Unity-Technologies/SZZUnleashed,Low popularity - General Unity package,Düşük Popülerlik,Genel Unity Paketi,Genel kullanıma uygun.
quickstart-arcade,Arcade Classics project is a collection of lightweight single scene games inspired by early arcade games.,32,https://github.com/Unity-Technologies/quickstart-arcade,Low popularity - General Unity package,Düşük Popülerlik,Genel Unity Paketi,Genel kullanıma uygun.
Labs,Repository containing information about Unity Labs research past and current. ,61,https://github.com/Unity-Technologies/Labs,Low popularity - Artificial intelligence package,Düşük Popülerlik,Yapay Zeka Paketi,Gelişmiş oyun yapay zekası geliştirenler için önerilir.
pdf.js,PDF Reader in JavaScript,3,https://github.com/Unity-Technologies/pdf.js,Low popularity - General Unity package,Düşük Popülerlik,Genel Unity Paketi,Genel kullanıma uygun.
ml-agents-dodgeball-env,Showcase environment for ML-Agents,65,https://github.com/Unity-Technologies/ml-agents-dodgeball-env,Low popularity - General Unity package,Düşük Popülerlik,Genel Unity Paketi,Genel kullanıma uygun.
dtls,DTLS 1.2 Server/Client implementation for Go,2,https://github.com/Unity-Technologies/dtls,Low popularity - General Unity package,Düşük Popülerlik,Genel Unity Paketi,Genel kullanıma uygun.
com.unity.vs-attribution,VS Attribution package repository,3,https://github.com/Unity-Technologies/com.unity.vs-attribution,Low popularity - General Unity package,Düşük Popülerlik,Genel Unity Paketi,Genel kullanıma uygun.
lookdev-studio,"LookDev Studio: a template for artists to import their work, and share the result with their directors, team and clients. ",70,https://github.com/Unity-Technologies/lookdev-studio,Low popularity - General Unity package,Düşük Popülerlik,Genel Unity Paketi,Genel kullanıma uygun.
DynamicResolutionSample,A drop-in dynamic resolution script,141,https://github.com/Unity-Technologies/DynamicResolutionSample,Mid-level popularity - General Unity package,Orta Popüler,Genel Unity Paketi,Genel kullanıma uygun.
gh-pr-content-checker,Action that checks whether the body or diff in a PR contains a certain word.,1,https://github.com/Unity-Technologies/gh-pr-content-checker,Low popularity - Artificial intelligence package,Düşük Popülerlik,Yapay Zeka Paketi,Gelişmiş oyun yapay zekası geliştirenler için önerilir.
electron-notarize,Notarize your macOS Electron Apps,1,https://github.com/Unity-Technologies/electron-notarize,Low popularity - General Unity package,Düşük Popülerlik,Genel Unity Paketi,Genel kullanıma uygun.
barracuda-starter-kit,Barracuda Starter Kit project. Selected tutorials and documentation for Unity Barracuda project. ,66,https://github.com/Unity-Technologies/barracuda-starter-kit,Low popularity - General Unity package,Düşük Popülerlik,Genel Unity Paketi,Genel kullanıma uygun.
opentelemetry-collector-contrib,Contrib repository for the OpenTelemetry Collector,2,https://github.com/Unity-Technologies/opentelemetry-collector-contrib,Low popularity - General Unity package,Düşük Popülerlik,Genel Unity Paketi,Genel kullanıma uygun.
backstage-upstream-fork,Backstage is an open platform for building developer portals,1,https://github.com/Unity-Technologies/backstage-upstream-fork,Low popularity - General Unity package,Düşük Popülerlik,Genel Unity Paketi,Genel kullanıma uygun.
PeopleSansPeople,Unity's privacy-preserving human-centric synthetic data generator,305,https://github.com/Unity-Technologies/PeopleSansPeople,Mid-level popularity - General Unity package,Orta Popüler,Genel Unity Paketi,Genel kullanıma uygun.
udp,A connection-oriented listener over a UDP PacketConn,2,https://github.com/Unity-Technologies/udp,Low popularity - General Unity package,Düşük Popülerlik,Genel Unity Paketi,Genel kullanıma uygun.
eslint-plugin-react,React specific linting rules for ESLint,1,https://github.com/Unity-Technologies/eslint-plugin-react,Low popularity - General Unity package,Düşük Popülerlik,Genel Unity Paketi,Genel kullanıma uygun.
metrics,"Machine learning metrics for distributed, scalable PyTorch applications.",2,https://github.com/Unity-Technologies/metrics,Low popularity - General Unity package,Düşük Popülerlik,Genel Unity Paketi,Genel kullanıma uygun.
paper-ml-agents,A repository to reproduce the experiments of the MA-POCA paper,18,https://github.com/Unity-Technologies/paper-ml-agents,Low popularity - General Unity package,Düşük Popülerlik,Genel Unity Paketi,Genel kullanıma uygun.
com.unity.services.samples,A collection of working examples of Unity Gaming Services.,142,https://github.com/Unity-Technologies/com.unity.services.samples,Mid-level popularity - General Unity package,Orta Popüler,Genel Unity Paketi,Genel kullanıma uygun.
com.unity.services.samples.use-cases,The collection of samples in this repo use Unity Gaming Services in a Unity project to demonstrate live gaming operations.,456,https://github.com/Unity-Technologies/com.unity.services.samples.use-cases,Mid-level popularity - General Unity package,Orta Popüler,Genel Unity Paketi,Genel kullanıma uygun.
quicktype,"Generate types and converters from JSON, Schema, and GraphQL",2,https://github.com/Unity-Technologies/quicktype,Low popularity - General Unity package,Düşük Popülerlik,Genel Unity Paketi,Genel kullanıma uygun.
UnityMeshImporter,Runtime mesh importer for Unity using AssimpNet,9,https://github.com/Unity-Technologies/UnityMeshImporter,Low popularity - General Unity package,Düşük Popülerlik,Genel Unity Paketi,Genel kullanıma uygun.
multiplay-examples,Examples for using Unity Multiplay: https://unity.com/products/multiplay,43,https://github.com/Unity-Technologies/multiplay-examples,Low popularity - General Unity package,Düşük Popülerlik,Genel Unity Paketi,Genel kullanıma uygun.
avro4s,Avro schema generation and serialization / deserialization for Scala,1,https://github.com/Unity-Technologies/avro4s,Low popularity - General Unity package,Düşük Popülerlik,Genel Unity Paketi,Genel kullanıma uygun.
runtime,".NET is a cross-platform runtime for cloud, mobile, desktop, and IoT apps.",47,https://github.com/Unity-Technologies/runtime,Low popularity - General Unity package,Düşük Popülerlik,Genel Unity Paketi,Genel kullanıma uygun.
Zenject,Dependency Injection Framework for Unity3D ,33,https://github.com/Unity-Technologies/Zenject,Low popularity - General Unity package,Düşük Popülerlik,Genel Unity Paketi,Genel kullanıma uygun.
unity-inverse-dynamics-demo,A small project showing off the Inverse dynamics available in Unity,99,https://github.com/Unity-Technologies/unity-inverse-dynamics-demo,Low popularity - Artificial intelligence package,Düşük Popülerlik,Yapay Zeka Paketi,Gelişmiş oyun yapay zekası geliştirenler için önerilir.
ccentral4j-1,Java client library for CCentral,1,https://github.com/Unity-Technologies/ccentral4j-1,Low popularity - General Unity package,Düşük Popülerlik,Genel Unity Paketi,Genel kullanıma uygun.
boat-attack-water,Package repo containing the water system created for the URP Boat Attack demo project.,335,https://github.com/Unity-Technologies/boat-attack-water,Mid-level popularity - Artificial intelligence package,Orta Popüler,Yapay Zeka Paketi,Gelişmiş oyun yapay zekası geliştirenler için önerilir.
liquibase,Main Liquibase Source,2,https://github.com/Unity-Technologies/liquibase,Low popularity - Artificial intelligence package,Düşük Popülerlik,Yapay Zeka Paketi,Gelişmiş oyun yapay zekası geliştirenler için önerilir.
ProjNet4GeoAPI,.NET Spatial Reference and Projection Engine,3,https://github.com/Unity-Technologies/ProjNet4GeoAPI,Low popularity - General Unity package,Düşük Popülerlik,Genel Unity Paketi,Genel kullanıma uygun.
pysolotools,Python toolchain for SOLO.,40,https://github.com/Unity-Technologies/pysolotools,Low popularity - Artificial intelligence package,Düşük Popülerlik,Yapay Zeka Paketi,Gelişmiş oyun yapay zekası geliştirenler için önerilir.
kubeflow,Machine Learning Toolkit for Kubernetes,4,https://github.com/Unity-Technologies/kubeflow,Low popularity - General Unity package,Düşük Popülerlik,Genel Unity Paketi,Genel kullanıma uygun.
sloop,Kubernetes History Visualization,1,https://github.com/Unity-Technologies/sloop,Low popularity - General Unity package,Düşük Popülerlik,Genel Unity Paketi,Genel kullanıma uygun.
external-dns,"Configure external DNS servers (AWS Route53, Google CloudDNS and others) for Kubernetes Ingresses and Services",2,https://github.com/Unity-Technologies/external-dns,Low popularity - General Unity package,Düşük Popülerlik,Genel Unity Paketi,Genel kullanıma uygun.
VHACD,"The V-HACD library decomposes a 3D surface into a set of ""near"" convex parts.",141,https://github.com/Unity-Technologies/VHACD,Mid-level popularity - General Unity package,Orta Popüler,Genel Unity Paketi,Genel kullanıma uygun.
ui-toolkit-manual-code-examples,Unity UI Toolkit documentation code examples,468,https://github.com/Unity-Technologies/ui-toolkit-manual-code-examples,Mid-level popularity - General Unity package,Orta Popüler,Genel Unity Paketi,Genel kullanıma uygun.
kubeflow-github-action,Repository for makeinga a GitHub Actions for deploying to Kubeflow. ,2,https://github.com/Unity-Technologies/kubeflow-github-action,Low popularity - General Unity package,Düşük Popülerlik,Genel Unity Paketi,Genel kullanıma uygun.
kompose,Go from Docker Compose to Kubernetes,1,https://github.com/Unity-Technologies/kompose,Low popularity - General Unity package,Düşük Popülerlik,Genel Unity Paketi,Genel kullanıma uygun.
kube_remediator,No description,1,https://github.com/Unity-Technologies/kube_remediator,Low popularity - General Unity package,Düşük Popülerlik,Genel Unity Paketi,Genel kullanıma uygun.
com.unity.services.samples.matchplay,A Matchmaking with Multiplay Unity example project. Implements the Unity Matchmaking and Multiplay SDK to create an end to end matchmaking game experience.,89,https://github.com/Unity-Technologies/com.unity.services.samples.matchplay,Low popularity - General Unity package,Düşük Popülerlik,Genel Unity Paketi,Genel kullanıma uygun.
com.unity.ml-agents,Unity ML-Agents Package,6,https://github.com/Unity-Technologies/com.unity.ml-agents,Low popularity - General Unity package,Düşük Popülerlik,Genel Unity Paketi,Genel kullanıma uygun.
oneTBB,oneAPI Threading Building Blocks (oneTBB),2,https://github.com/Unity-Technologies/oneTBB,Low popularity - General Unity package,Düşük Popülerlik,Genel Unity Paketi,Genel kullanıma uygun.
com.unity.cinecast.sample-wildwest,This sample showcases all the basic functionalities of Cinecast SDK.,4,https://github.com/Unity-Technologies/com.unity.cinecast.sample-wildwest,Low popularity - General Unity package,Düşük Popülerlik,Genel Unity Paketi,Genel kullanıma uygun.
com.unity.cloud.gltfast,Efficient glTF 3D import / export library for Unity,82,https://github.com/Unity-Technologies/com.unity.cloud.gltfast,Low popularity - General Unity package,Düşük Popülerlik,Genel Unity Paketi,Genel kullanıma uygun.
pyrra,"Making SLOs with Prometheus manageable, accessible, and easy to use for everyone!",1,https://github.com/Unity-Technologies/pyrra,Low popularity - General Unity package,Düşük Popülerlik,Genel Unity Paketi,Genel kullanıma uygun.
saramaprom,Metrics exporter from Sarama to Prometheus.,1,https://github.com/Unity-Technologies/saramaprom,Low popularity - General Unity package,Düşük Popülerlik,Genel Unity Paketi,Genel kullanıma uygun.
UnityDataTools,Experimental tools and libraries for reading and analyzing Unity data files.,582,https://github.com/Unity-Technologies/UnityDataTools,Popular - Vehicle package,Popüler,Araç Paketi,Genel kullanıma uygun.
